{
  "table_name": "v2_bills",
  "columns": [
    {
      "Field": "branch_id",
      "Type": "varchar(20)",
      "Null": "YES",
      "Key": "",
      "Default": null,
      "Extra": ""
    },
    {
      "Field": "bill_id",
      "Type": "int(11)",
      "Null": "NO",
      "Key": "PRI",
      "Default": null,
      "Extra": "auto_increment"
    },
    {
      "Field": "member_id",
      "Type": "int(11)",
      "Null": "YES",
      "Key": "",
      "Default": null,
      "Extra": ""
    },
    {
      "Field": "bill_date",
      "Type": "date",
      "Null": "YES",
      "Key": "",
      "Default": null,
      "Extra": ""
    },
    {
      "Field": "bill_type",
      "Type": "varchar(20)",
      "Null": "YES",
      "Key": "",
      "Default": null,
      "Extra": ""
    },
    {
      "Field": "bill_text",
      "Type": "text",
      "Null": "YES",
      "Key": "",
      "Default": null,
      "Extra": ""
    },
    {
      "Field": "bill_totalamt",
      "Type": "int(11)",
      "Null": "YES",
      "Key": "",
      "Default": null,
      "Extra": ""
    },
    {
      "Field": "bill_deduction",
      "Type": "int(11)",
      "Null": "YES",
      "Key": "",
      "Default": null,
      "Extra": ""
    },
    {
      "Field": "bill_netamt",
      "Type": "int(11)",
      "Null": "YES",
      "Key": "",
      "Default": null,
      "Extra": ""
    },
    {
      "Field": "bill_timestamp",
      "Type": "timestamp",
      "Null": "YES",
      "Key": "",
      "Default": null,
      "Extra": ""
    },
    {
      "Field": "bill_balance_before",
      "Type": "int(11)",
      "Null": "YES",
      "Key": "",
      "Default": null,
      "Extra": ""
    },
    {
      "Field": "bill_balance_after",
      "Type": "int(11)",
      "Null": "YES",
      "Key": "",
      "Default": null,
      "Extra": ""
    },
    {
      "Field": "reservation_id",
      "Type": "varchar(50)",
      "Null": "YES",
      "Key": "",
      "Default": null,
      "Extra": ""
    },
    {
      "Field": "bill_status",
      "Type": "varchar(100)",
      "Null": "YES",
      "Key": "",
      "Default": null,
      "Extra": ""
    },
    {
      "Field": "contract_history_id",
      "Type": "int(11)",
      "Null": "YES",
      "Key": "",
      "Default": null,
      "Extra": ""
    },
    {
      "Field": "locker_bill_id",
      "Type": "int(11)",
      "Null": "YES",
      "Key": "",
      "Default": null,
      "Extra": ""
    },
    {
      "Field": "routine_id",
      "Type": "int(11)",
      "Null": "YES",
      "Key": "",
      "Default": null,
      "Extra": ""
    },
    {
      "Field": "contract_credit_expiry_date",
      "Type": "date",
      "Null": "YES",
      "Key": "",
      "Default": null,
      "Extra": ""
    }
  ],
  "create_statement": "CREATE TABLE `v2_bills` (\n  `branch_id` varchar(20) DEFAULT NULL,\n  `bill_id` int(11) NOT NULL AUTO_INCREMENT,\n  `member_id` int(11) DEFAULT NULL,\n  `bill_date` date DEFAULT NULL,\n  `bill_type` varchar(20) DEFAULT NULL,\n  `bill_text` text DEFAULT NULL,\n  `bill_totalamt` int(11) DEFAULT NULL,\n  `bill_deduction` int(11) DEFAULT NULL,\n  `bill_netamt` int(11) DEFAULT NULL,\n  `bill_timestamp` timestamp NULL DEFAULT NULL,\n  `bill_balance_before` int(11) DEFAULT NULL,\n  `bill_balance_after` int(11) DEFAULT NULL,\n  `reservation_id` varchar(50) DEFAULT NULL,\n  `bill_status` varchar(100) DEFAULT NULL,\n  `contract_history_id` int(11) DEFAULT NULL,\n  `locker_bill_id` int(11) DEFAULT NULL,\n  `routine_id` int(11) DEFAULT NULL,\n  `contract_credit_expiry_date` date DEFAULT NULL,\n  PRIMARY KEY (`bill_id`)\n) ENGINE=InnoDB AUTO_INCREMENT=53130 DEFAULT CHARSET=utf8mb4 COLLATE=utf8mb4_unicode_ci",
  "indexes": [
    {
      "Table": "v2_bills",
      "Non_unique": 0,
      "Key_name": "PRIMARY",
      "Seq_in_index": 1,
      "Column_name": "bill_id",
      "Collation": "A",
      "Cardinality": 53083,
      "Sub_part": null,
      "Packed": null,
      "Null": "",
      "Index_type": "BTREE",
      "Comment": ""
    }
  ],
  "backup_timestamp": "2025-11-29T23:45:27.654783"
}