{
  "table_name": "v2_board_by_member",
  "columns": [
    {
      "Field": "branch_id",
      "Type": "varchar(20)",
      "Null": "YES",
      "Key": "",
      "Default": null,
      "Extra": ""
    },
    {
      "Field": "memberboard_id",
      "Type": "int(11)",
      "Null": "NO",
      "Key": "PRI",
      "Default": null,
      "Extra": "auto_increment"
    },
    {
      "Field": "title",
      "Type": "varchar(100)",
      "Null": "NO",
      "Key": "",
      "Default": null,
      "Extra": ""
    },
    {
      "Field": "content",
      "Type": "text",
      "Null": "NO",
      "Key": "",
      "Default": null,
      "Extra": ""
    },
    {
      "Field": "board_type",
      "Type": "varchar(100)",
      "Null": "NO",
      "Key": "",
      "Default": null,
      "Extra": ""
    },
    {
      "Field": "created_at",
      "Type": "datetime",
      "Null": "YES",
      "Key": "",
      "Default": "current_timestamp()",
      "Extra": ""
    },
    {
      "Field": "updated_at",
      "Type": "datetime",
      "Null": "YES",
      "Key": "",
      "Default": "current_timestamp()",
      "Extra": "on update current_timestamp()"
    },
    {
      "Field": "member_id",
      "Type": "int(11)",
      "Null": "YES",
      "Key": "",
      "Default": null,
      "Extra": ""
    },
    {
      "Field": "post_status",
      "Type": "varchar(100)",
      "Null": "YES",
      "Key": "",
      "Default": null,
      "Extra": ""
    },
    {
      "Field": "post_due_date",
      "Type": "date",
      "Null": "YES",
      "Key": "",
      "Default": null,
      "Extra": ""
    },
    {
      "Field": "member_name",
      "Type": "varchar(50)",
      "Null": "YES",
      "Key": "",
      "Default": null,
      "Extra": ""
    }
  ],
  "create_statement": "CREATE TABLE `v2_board_by_member` (\n  `branch_id` varchar(20) DEFAULT NULL,\n  `memberboard_id` int(11) NOT NULL AUTO_INCREMENT,\n  `title` varchar(100) NOT NULL,\n  `content` text NOT NULL,\n  `board_type` varchar(100) NOT NULL,\n  `created_at` datetime DEFAULT current_timestamp(),\n  `updated_at` datetime DEFAULT current_timestamp() ON UPDATE current_timestamp(),\n  `member_id` int(11) DEFAULT NULL,\n  `post_status` varchar(100) DEFAULT NULL,\n  `post_due_date` date DEFAULT NULL,\n  `member_name` varchar(50) DEFAULT NULL,\n  PRIMARY KEY (`memberboard_id`)\n) ENGINE=InnoDB AUTO_INCREMENT=11 DEFAULT CHARSET=utf8mb4 COLLATE=utf8mb4_unicode_ci",
  "indexes": [
    {
      "Table": "v2_board_by_member",
      "Non_unique": 0,
      "Key_name": "PRIMARY",
      "Seq_in_index": 1,
      "Column_name": "memberboard_id",
      "Collation": "A",
      "Cardinality": 8,
      "Sub_part": null,
      "Packed": null,
      "Null": "",
      "Index_type": "BTREE",
      "Comment": ""
    }
  ],
  "backup_timestamp": "2025-11-29T23:45:28.801710"
}