{
  "table_name": "v2_eventhandicap_LS",
  "columns": [
    {
      "Field": "branch_id",
      "Type": "varchar(20)",
      "Null": "YES",
      "Key": "",
      "Default": null,
      "Extra": ""
    },
    {
      "Field": "LS_id",
      "Type": "varchar(30)",
      "Null": "YES",
      "Key": "UNI",
      "Default": null,
      "Extra": ""
    },
    {
      "Field": "LS_date",
      "Type": "date",
      "Null": "YES",
      "Key": "",
      "Default": null,
      "Extra": ""
    },
    {
      "Field": "member_id",
      "Type": "int(11)",
      "Null": "YES",
      "Key": "",
      "Default": null,
      "Extra": ""
    },
    {
      "Field": "LS_status",
      "Type": "varchar(10)",
      "Null": "YES",
      "Key": "",
      "Default": null,
      "Extra": ""
    },
    {
      "Field": "member_name",
      "Type": "varchar(20)",
      "Null": "YES",
      "Key": "",
      "Default": null,
      "Extra": ""
    },
    {
      "Field": "member_type",
      "Type": "varchar(10)",
      "Null": "YES",
      "Key": "",
      "Default": null,
      "Extra": ""
    },
    {
      "Field": "LS_type",
      "Type": "varchar(20)",
      "Null": "YES",
      "Key": "",
      "Default": null,
      "Extra": ""
    },
    {
      "Field": "pro_id",
      "Type": "int(11)",
      "Null": "YES",
      "Key": "",
      "Default": null,
      "Extra": ""
    },
    {
      "Field": "pro_name",
      "Type": "varchar(10)",
      "Null": "YES",
      "Key": "",
      "Default": null,
      "Extra": ""
    },
    {
      "Field": "LS_net_min",
      "Type": "int(11)",
      "Null": "YES",
      "Key": "",
      "Default": null,
      "Extra": ""
    },
    {
      "Field": "updated_at",
      "Type": "timestamp",
      "Null": "YES",
      "Key": "",
      "Default": "current_timestamp()",
      "Extra": "on update current_timestamp()"
    },
    {
      "Field": "memo",
      "Type": "text",
      "Null": "YES",
      "Key": "",
      "Default": null,
      "Extra": ""
    }
  ],
  "create_statement": "CREATE TABLE `v2_eventhandicap_LS` (\n  `branch_id` varchar(20) DEFAULT NULL,\n  `LS_id` varchar(30) DEFAULT NULL,\n  `LS_date` date DEFAULT NULL,\n  `member_id` int(11) DEFAULT NULL,\n  `LS_status` varchar(10) DEFAULT NULL,\n  `member_name` varchar(20) DEFAULT NULL,\n  `member_type` varchar(10) DEFAULT NULL,\n  `LS_type` varchar(20) DEFAULT NULL,\n  `pro_id` int(11) DEFAULT NULL,\n  `pro_name` varchar(10) DEFAULT NULL,\n  `LS_net_min` int(11) DEFAULT NULL,\n  `updated_at` timestamp NULL DEFAULT current_timestamp() ON UPDATE current_timestamp(),\n  `memo` text DEFAULT NULL,\n  UNIQUE KEY `LS_id` (`LS_id`)\n) ENGINE=InnoDB DEFAULT CHARSET=utf8mb4 COLLATE=utf8mb4_unicode_ci",
  "indexes": [
    {
      "Table": "v2_eventhandicap_LS",
      "Non_unique": 0,
      "Key_name": "LS_id",
      "Seq_in_index": 1,
      "Column_name": "LS_id",
      "Collation": "A",
      "Cardinality": 331,
      "Sub_part": null,
      "Packed": null,
      "Null": "YES",
      "Index_type": "BTREE",
      "Comment": ""
    }
  ],
  "backup_timestamp": "2025-11-29T23:45:29.077381"
}