{
  "table_name": "v2_LS_orders",
  "columns": [
    {
      "Field": "branch_id",
      "Type": "varchar(20)",
      "Null": "YES",
      "Key": "",
      "Default": null,
      "Extra": ""
    },
    {
      "Field": "LS_id",
      "Type": "varchar(30)",
      "Null": "YES",
      "Key": "UNI",
      "Default": null,
      "Extra": ""
    },
    {
      "Field": "LS_transaction_type",
      "Type": "varchar(20)",
      "Null": "YES",
      "Key": "",
      "Default": null,
      "Extra": ""
    },
    {
      "Field": "LS_date",
      "Type": "date",
      "Null": "YES",
      "Key": "",
      "Default": null,
      "Extra": ""
    },
    {
      "Field": "member_id",
      "Type": "int(11)",
      "Null": "YES",
      "Key": "",
      "Default": null,
      "Extra": ""
    },
    {
      "Field": "LS_status",
      "Type": "varchar(10)",
      "Null": "YES",
      "Key": "",
      "Default": null,
      "Extra": ""
    },
    {
      "Field": "member_name",
      "Type": "varchar(20)",
      "Null": "YES",
      "Key": "",
      "Default": null,
      "Extra": ""
    },
    {
      "Field": "member_type",
      "Type": "varchar(10)",
      "Null": "YES",
      "Key": "",
      "Default": null,
      "Extra": ""
    },
    {
      "Field": "LS_type",
      "Type": "varchar(20)",
      "Null": "YES",
      "Key": "",
      "Default": null,
      "Extra": ""
    },
    {
      "Field": "pro_id",
      "Type": "int(11)",
      "Null": "YES",
      "Key": "",
      "Default": null,
      "Extra": ""
    },
    {
      "Field": "pro_name",
      "Type": "varchar(10)",
      "Null": "YES",
      "Key": "",
      "Default": null,
      "Extra": ""
    },
    {
      "Field": "LS_order_source",
      "Type": "varchar(15)",
      "Null": "YES",
      "Key": "",
      "Default": null,
      "Extra": ""
    },
    {
      "Field": "LS_start_time",
      "Type": "time",
      "Null": "YES",
      "Key": "",
      "Default": null,
      "Extra": ""
    },
    {
      "Field": "LS_end_time",
      "Type": "time",
      "Null": "YES",
      "Key": "",
      "Default": null,
      "Extra": ""
    },
    {
      "Field": "LS_net_min",
      "Type": "int(11)",
      "Null": "YES",
      "Key": "",
      "Default": null,
      "Extra": ""
    },
    {
      "Field": "updated_at",
      "Type": "timestamp",
      "Null": "YES",
      "Key": "",
      "Default": "current_timestamp()",
      "Extra": "on update current_timestamp()"
    },
    {
      "Field": "TS_id",
      "Type": "int(11)",
      "Null": "YES",
      "Key": "",
      "Default": null,
      "Extra": ""
    },
    {
      "Field": "program_id",
      "Type": "varchar(20)",
      "Null": "YES",
      "Key": "",
      "Default": null,
      "Extra": ""
    },
    {
      "Field": "routine_id",
      "Type": "int(11)",
      "Null": "YES",
      "Key": "",
      "Default": null,
      "Extra": ""
    },
    {
      "Field": "LS_request",
      "Type": "text",
      "Null": "YES",
      "Key": "",
      "Default": null,
      "Extra": ""
    },
    {
      "Field": "LS_contract_id",
      "Type": "int(11)",
      "Null": "YES",
      "Key": "",
      "Default": null,
      "Extra": ""
    },
    {
      "Field": "LS_confirm",
      "Type": "varchar(20)",
      "Null": "YES",
      "Key": "",
      "Default": null,
      "Extra": ""
    },
    {
      "Field": "LS_feedback_good",
      "Type": "text",
      "Null": "YES",
      "Key": "",
      "Default": null,
      "Extra": ""
    },
    {
      "Field": "LS_feedback_homework",
      "Type": "text",
      "Null": "YES",
      "Key": "",
      "Default": null,
      "Extra": ""
    },
    {
      "Field": "LS_feedback_nextlesson",
      "Type": "text",
      "Null": "YES",
      "Key": "",
      "Default": null,
      "Extra": ""
    },
    {
      "Field": "LS_count",
      "Type": "decimal(10,0)",
      "Null": "YES",
      "Key": "",
      "Default": null,
      "Extra": ""
    }
  ],
  "create_statement": "CREATE TABLE `v2_LS_orders` (\n  `branch_id` varchar(20) DEFAULT NULL,\n  `LS_id` varchar(30) DEFAULT NULL,\n  `LS_transaction_type` varchar(20) DEFAULT NULL,\n  `LS_date` date DEFAULT NULL,\n  `member_id` int(11) DEFAULT NULL,\n  `LS_status` varchar(10) DEFAULT NULL,\n  `member_name` varchar(20) DEFAULT NULL,\n  `member_type` varchar(10) DEFAULT NULL,\n  `LS_type` varchar(20) DEFAULT NULL,\n  `pro_id` int(11) DEFAULT NULL,\n  `pro_name` varchar(10) DEFAULT NULL,\n  `LS_order_source` varchar(15) DEFAULT NULL,\n  `LS_start_time` time DEFAULT NULL,\n  `LS_end_time` time DEFAULT NULL,\n  `LS_net_min` int(11) DEFAULT NULL,\n  `updated_at` timestamp NULL DEFAULT current_timestamp() ON UPDATE current_timestamp(),\n  `TS_id` int(11) DEFAULT NULL,\n  `program_id` varchar(20) DEFAULT NULL,\n  `routine_id` int(11) DEFAULT NULL,\n  `LS_request` text DEFAULT NULL,\n  `LS_contract_id` int(11) DEFAULT NULL,\n  `LS_confirm` varchar(20) DEFAULT NULL,\n  `LS_feedback_good` text DEFAULT NULL,\n  `LS_feedback_homework` text DEFAULT NULL,\n  `LS_feedback_nextlesson` text DEFAULT NULL,\n  `LS_count` decimal(10,0) DEFAULT NULL,\n  UNIQUE KEY `LS_id` (`LS_id`)\n) ENGINE=InnoDB DEFAULT CHARSET=utf8mb4 COLLATE=utf8mb4_unicode_ci",
  "indexes": [
    {
      "Table": "v2_LS_orders",
      "Non_unique": 0,
      "Key_name": "LS_id",
      "Seq_in_index": 1,
      "Column_name": "LS_id",
      "Collation": "A",
      "Cardinality": 14422,
      "Sub_part": null,
      "Packed": null,
      "Null": "YES",
      "Index_type": "BTREE",
      "Comment": ""
    }
  ],
  "backup_timestamp": "2025-11-29T23:45:26.820080"
}