{
  "table_name": "v2_message",
  "columns": [
    {
      "Field": "branch_id",
      "Type": "varchar(20)",
      "Null": "YES",
      "Key": "",
      "Default": null,
      "Extra": ""
    },
    {
      "Field": "msg_id",
      "Type": "int(11)",
      "Null": "NO",
      "Key": "PRI",
      "Default": null,
      "Extra": "auto_increment"
    },
    {
      "Field": "msg_type",
      "Type": "varchar(15)",
      "Null": "YES",
      "Key": "",
      "Default": null,
      "Extra": ""
    },
    {
      "Field": "member_id",
      "Type": "int(11)",
      "Null": "YES",
      "Key": "",
      "Default": null,
      "Extra": ""
    },
    {
      "Field": "member_name",
      "Type": "varchar(100)",
      "Null": "YES",
      "Key": "",
      "Default": null,
      "Extra": ""
    },
    {
      "Field": "member_phone",
      "Type": "varchar(30)",
      "Null": "YES",
      "Key": "",
      "Default": null,
      "Extra": ""
    },
    {
      "Field": "msg",
      "Type": "text",
      "Null": "YES",
      "Key": "",
      "Default": null,
      "Extra": ""
    },
    {
      "Field": "msg_status",
      "Type": "varchar(10)",
      "Null": "YES",
      "Key": "",
      "Default": null,
      "Extra": ""
    },
    {
      "Field": "msg_sent_at",
      "Type": "timestamp",
      "Null": "YES",
      "Key": "",
      "Default": null,
      "Extra": ""
    },
    {
      "Field": "message_read_at",
      "Type": "timestamp",
      "Null": "YES",
      "Key": "",
      "Default": null,
      "Extra": ""
    },
    {
      "Field": "msg_date",
      "Type": "date",
      "Null": "YES",
      "Key": "",
      "Default": null,
      "Extra": ""
    },
    {
      "Field": "msg_plantime",
      "Type": "time",
      "Null": "YES",
      "Key": "",
      "Default": null,
      "Extra": ""
    },
    {
      "Field": "push_status",
      "Type": "varchar(20)",
      "Null": "YES",
      "Key": "",
      "Default": null,
      "Extra": ""
    },
    {
      "Field": "push_timestamp",
      "Type": "timestamp",
      "Null": "YES",
      "Key": "",
      "Default": null,
      "Extra": ""
    },
    {
      "Field": "push_agreement",
      "Type": "varchar(20)",
      "Null": "YES",
      "Key": "",
      "Default": null,
      "Extra": ""
    },
    {
      "Field": "msg_registered_at",
      "Type": "timestamp",
      "Null": "YES",
      "Key": "",
      "Default": null,
      "Extra": ""
    }
  ],
  "create_statement": "CREATE TABLE `v2_message` (\n  `branch_id` varchar(20) DEFAULT NULL,\n  `msg_id` int(11) NOT NULL AUTO_INCREMENT,\n  `msg_type` varchar(15) DEFAULT NULL,\n  `member_id` int(11) DEFAULT NULL,\n  `member_name` varchar(100) DEFAULT NULL,\n  `member_phone` varchar(30) DEFAULT NULL,\n  `msg` text DEFAULT NULL,\n  `msg_status` varchar(10) DEFAULT NULL,\n  `msg_sent_at` timestamp NULL DEFAULT NULL,\n  `message_read_at` timestamp NULL DEFAULT NULL,\n  `msg_date` date DEFAULT NULL,\n  `msg_plantime` time DEFAULT NULL,\n  `push_status` varchar(20) DEFAULT NULL,\n  `push_timestamp` timestamp NULL DEFAULT NULL,\n  `push_agreement` varchar(20) DEFAULT NULL,\n  `msg_registered_at` timestamp NULL DEFAULT NULL,\n  PRIMARY KEY (`msg_id`)\n) ENGINE=InnoDB AUTO_INCREMENT=20 DEFAULT CHARSET=utf8mb4 COLLATE=utf8mb4_unicode_ci",
  "indexes": [
    {
      "Table": "v2_message",
      "Non_unique": 0,
      "Key_name": "PRIMARY",
      "Seq_in_index": 1,
      "Column_name": "msg_id",
      "Collation": "A",
      "Cardinality": 10,
      "Sub_part": null,
      "Packed": null,
      "Null": "",
      "Index_type": "BTREE",
      "Comment": ""
    }
  ],
  "backup_timestamp": "2025-11-29T23:45:29.272398"
}